{
  "$schema": "../game-dataset.schema.json",
  "schemaVersion": 1,
  "id": "hero-profiles",
  "source": {
    "name": "Last Asylum Database",
    "url": "https://lastasylumdatabase.com/heroes",
    "type": "community",
    "status": "complete",
    "verifiedOn": "2026-08-25"
  },
  "semantics": {
    "valueMode": "lookup",
    "note": "Hero profile values are current values, not values to add across ranks."
  },
  "data": {
    "annie": {
      "gameId": "50011",
      "title": "helpful",
      "maxRank": 50,
      "awakenable": true,
      "counters": "ranger",
      "counteredBy": "warrior"
    },
    "arthur": {
      "gameId": "10007",
      "title": "diligent",
      "maxRank": 50,
      "awakenable": false,
      "counters": "warlock",
      "counteredBy": "ranger"
    },
    "bell": {
      "gameId": "50008",
      "title": "diligent",
      "maxRank": 50,
      "awakenable": false,
      "counters": "warrior",
      "counteredBy": "warlock"
    },
    "billy": {
      "gameId": "50009",
      "title": "helpful",
      "maxRank": 50,
      "awakenable": false,
      "counters": "ranger",
      "counteredBy": "warrior"
    },
    "cynthia": {
      "gameId": "50006",
      "title": "diligent",
      "maxRank": 50,
      "awakenable": true,
      "counters": "warrior",
      "counteredBy": "warlock"
    },
    "daskal": {
      "gameId": "50001",
      "title": "helpful",
      "maxRank": 50,
      "awakenable": false,
      "counters": "warlock",
      "counteredBy": "ranger"
    },
    "harper": {
      "gameId": "50002",
      "title": "diligent",
      "maxRank": 50,
      "awakenable": false,
      "counters": "warlock",
      "counteredBy": "ranger"
    },
    "joker": {
      "gameId": "50012",
      "title": "steady",
      "maxRank": 50,
      "awakenable": false,
      "counters": "ranger",
      "counteredBy": "warrior"
    },
    "louis": {
      "gameId": "50005",
      "title": "steady",
      "maxRank": 50,
      "awakenable": false,
      "counters": "warrior",
      "counteredBy": "warlock"
    },
    "marlena": {
      "gameId": "30006",
      "title": "helpful",
      "maxRank": 50,
      "awakenable": true,
      "counters": "warlock",
      "counteredBy": "ranger"
    },
    "nicole": {
      "gameId": "50013",
      "title": "helpful",
      "maxRank": 50,
      "awakenable": false,
      "counters": "ranger",
      "counteredBy": "warrior"
    },
    "red-lady": {
      "gameId": "50007",
      "title": "steady",
      "maxRank": 50,
      "awakenable": false,
      "counters": "warrior",
      "counteredBy": "warlock"
    },
    "shadow": {
      "gameId": "50004",
      "title": "steady",
      "maxRank": 50,
      "awakenable": false,
      "counters": "warrior",
      "counteredBy": "warlock"
    },
    "ulfrid": {
      "gameId": "50010",
      "title": "diligent",
      "maxRank": 50,
      "awakenable": false,
      "counters": "ranger",
      "counteredBy": "warrior"
    },
    "zoya": {
      "gameId": "50003",
      "title": "helpful",
      "maxRank": 50,
      "awakenable": false,
      "counters": "warlock",
      "counteredBy": "ranger"
    },
    "ash": {
      "gameId": "40010",
      "title": "brave",
      "maxRank": 50,
      "awakenable": false,
      "counters": "warrior",
      "counteredBy": "warlock"
    },
    "bella": {
      "gameId": "30001",
      "title": "aloof",
      "maxRank": 50,
      "awakenable": false,
      "counters": "warlock",
      "counteredBy": "ranger"
    },
    "bestar": {
      "gameId": "30005",
      "title": "helpful",
      "maxRank": 50,
      "awakenable": false,
      "counters": "warrior",
      "counteredBy": "warlock"
    },
    "celia": {
      "gameId": "10006",
      "title": "diligent",
      "maxRank": 50,
      "awakenable": false,
      "counters": "warlock",
      "counteredBy": "ranger"
    },
    "claire": {
      "gameId": "30003",
      "title": "helpful",
      "maxRank": 50,
      "awakenable": false,
      "counters": "warlock",
      "counteredBy": "ranger"
    },
    "grenwald": {
      "gameId": "30004",
      "title": "smart",
      "maxRank": 50,
      "awakenable": false,
      "counters": "ranger",
      "counteredBy": "warrior"
    },
    "griffith": {
      "gameId": "20006",
      "title": "diligent",
      "maxRank": 50,
      "awakenable": false,
      "counters": "warrior",
      "counteredBy": "warlock"
    },
    "hastar": {
      "gameId": "30007",
      "title": "diligent",
      "maxRank": 50,
      "awakenable": false,
      "counters": "ranger",
      "counteredBy": "warrior"
    },
    "kesso": {
      "gameId": "10005",
      "title": "diligent",
      "maxRank": 50,
      "awakenable": false,
      "counters": "warlock",
      "counteredBy": "ranger"
    },
    "lucius": {
      "gameId": "10008",
      "title": "helpful",
      "maxRank": 50,
      "awakenable": false,
      "counters": "warlock",
      "counteredBy": "ranger"
    },
    "sivir": {
      "gameId": "20009",
      "title": "steady",
      "maxRank": 50,
      "awakenable": false,
      "counters": "warlock",
      "counteredBy": "ranger"
    },
    "stellar": {
      "gameId": "20005",
      "title": "helpful",
      "maxRank": 50,
      "awakenable": false,
      "counters": "ranger",
      "counteredBy": "warrior"
    },
    "durant": {
      "gameId": "40001",
      "title": "steady",
      "maxRank": 50,
      "awakenable": false,
      "counters": "warlock",
      "counteredBy": "ranger"
    },
    "kafa": {
      "gameId": "30010",
      "title": "steady",
      "maxRank": 50,
      "awakenable": false,
      "counters": "ranger",
      "counteredBy": "warrior"
    },
    "robin": {
      "gameId": "30011",
      "title": "complacent",
      "maxRank": 50,
      "awakenable": false,
      "counters": "warrior",
      "counteredBy": "warlock"
    },
    "william": {
      "gameId": "40002",
      "title": "diligent",
      "maxRank": 50,
      "awakenable": false,
      "counters": "warlock",
      "counteredBy": "ranger"
    }
  }
}
