{
  "$schema": "../game-dataset.schema.json",
  "schemaVersion": 1,
  "id": "hero-stars",
  "source": {
    "name": "Last Asylum Plague",
    "url": "https://lastasylumplague.com/database/heroes-upgrade-requirements-antitoxins-stars-skill-badges/",
    "type": "community",
    "status": "complete",
    "verifiedOn": "2026-08-23"
  },
  "semantics": {
    "valueMode": "upgrade-to-level",
    "note": "Each cost is the hero-specific or Omni Fragment cost of reaching the listed star step."
  },
  "data": [
    {
      "value": 0.0,
      "cost": 0
    },
    {
      "value": 0.2,
      "cost": 2
    },
    {
      "value": 0.4,
      "cost": 2
    },
    {
      "value": 0.6,
      "cost": 2
    },
    {
      "value": 0.8,
      "cost": 2
    },
    {
      "value": 1.0,
      "cost": 2
    },
    {
      "value": 1.2,
      "cost": 3
    },
    {
      "value": 1.4,
      "cost": 3
    },
    {
      "value": 1.6,
      "cost": 3
    },
    {
      "value": 1.8,
      "cost": 3
    },
    {
      "value": 2.0,
      "cost": 3
    },
    {
      "value": 2.2,
      "cost": 4
    },
    {
      "value": 2.4,
      "cost": 4
    },
    {
      "value": 2.6,
      "cost": 4
    },
    {
      "value": 2.8,
      "cost": 4
    },
    {
      "value": 3.0,
      "cost": 4
    },
    {
      "value": 3.2,
      "cost": 6
    },
    {
      "value": 3.4,
      "cost": 6
    },
    {
      "value": 3.6,
      "cost": 6
    },
    {
      "value": 3.8,
      "cost": 6
    },
    {
      "value": 4.0,
      "cost": 6
    },
    {
      "value": 4.2,
      "cost": 8
    },
    {
      "value": 4.4,
      "cost": 8
    },
    {
      "value": 4.6,
      "cost": 8
    },
    {
      "value": 4.8,
      "cost": 8
    },
    {
      "value": 5.0,
      "cost": 8
    },
    {
      "value": 5.2,
      "cost": 12
    },
    {
      "value": 5.4,
      "cost": 12
    },
    {
      "value": 5.6,
      "cost": 12
    },
    {
      "value": 5.8,
      "cost": 12
    },
    {
      "value": 6.0,
      "cost": 12
    },
    {
      "value": 6.2,
      "cost": 25
    },
    {
      "value": 6.4,
      "cost": 25
    },
    {
      "value": 6.6,
      "cost": 25
    },
    {
      "value": 6.8,
      "cost": 25
    },
    {
      "value": 7.0,
      "cost": 25
    },
    {
      "value": 7.2,
      "cost": 35
    },
    {
      "value": 7.4,
      "cost": 35
    },
    {
      "value": 7.6,
      "cost": 35
    },
    {
      "value": 7.8,
      "cost": 35
    },
    {
      "value": 8.0,
      "cost": 35
    },
    {
      "value": 8.2,
      "cost": 40
    },
    {
      "value": 8.4,
      "cost": 40
    },
    {
      "value": 8.6,
      "cost": 40
    },
    {
      "value": 8.8,
      "cost": 40
    },
    {
      "value": 9.0,
      "cost": 40
    },
    {
      "value": 9.2,
      "cost": 60
    },
    {
      "value": 9.4,
      "cost": 60
    },
    {
      "value": 9.6,
      "cost": 60
    },
    {
      "value": 9.8,
      "cost": 60
    },
    {
      "value": 10.0,
      "cost": 60
    }
  ]
}
