{
  "$schema": "../game-dataset.schema.json",
  "schemaVersion": 1,
  "id": "hero-catalog",
  "source": {
    "name": "Last Asylum Database",
    "url": "https://lastasylumdatabase.com/heroes",
    "type": "community",
    "status": "complete",
    "verifiedOn": "2026-08-25"
  },
  "semantics": {
    "valueMode": "lookup",
    "note": "Stable hero identity, rarity, faction, role and image lookup."
  },
  "data": [
    {
      "id": "annie",
      "name": "Annie",
      "rarity": "ur",
      "faction": "warlock",
      "role": "carry",
      "image": "assets/images/heroes/annie.webp"
    },
    {
      "id": "arthur",
      "name": "Arthur",
      "rarity": "ur",
      "faction": "warrior",
      "role": "tank",
      "image": "assets/images/heroes/arthur.webp"
    },
    {
      "id": "bell",
      "name": "Bell",
      "rarity": "ur",
      "faction": "ranger",
      "role": "support",
      "image": "assets/images/heroes/bell.webp"
    },
    {
      "id": "billy",
      "name": "Billy",
      "rarity": "ur",
      "faction": "warlock",
      "role": "tank",
      "image": "assets/images/heroes/billy.webp"
    },
    {
      "id": "cynthia",
      "name": "Cynthia",
      "rarity": "ur",
      "faction": "ranger",
      "role": "carry",
      "image": "assets/images/heroes/cynthia.webp"
    },
    {
      "id": "daskal",
      "name": "Daskal",
      "rarity": "ur",
      "faction": "warrior",
      "role": "tank",
      "image": "assets/images/heroes/daskal.webp"
    },
    {
      "id": "harper",
      "name": "Harper",
      "rarity": "ur",
      "faction": "warrior",
      "role": "support",
      "image": "assets/images/heroes/harper.webp"
    },
    {
      "id": "joker",
      "name": "Joker",
      "rarity": "ur",
      "faction": "warlock",
      "role": "carry",
      "image": "assets/images/heroes/joker.webp"
    },
    {
      "id": "louis",
      "name": "Louis",
      "rarity": "ur",
      "faction": "ranger",
      "role": "tank",
      "image": "assets/images/heroes/louis.webp"
    },
    {
      "id": "marlena",
      "name": "Marlena",
      "rarity": "ur",
      "faction": "warrior",
      "role": "carry",
      "image": "assets/images/heroes/marlena.webp"
    },
    {
      "id": "nicole",
      "name": "Nicole",
      "rarity": "ur",
      "faction": "warlock",
      "role": "support",
      "image": "assets/images/heroes/nicole.webp"
    },
    {
      "id": "red-lady",
      "name": "Red Lady",
      "rarity": "ur",
      "faction": "ranger",
      "role": "carry",
      "image": "assets/images/heroes/red-lady.webp"
    },
    {
      "id": "shadow",
      "name": "Shadow",
      "rarity": "ur",
      "faction": "ranger",
      "role": "tank",
      "image": "assets/images/heroes/shadow.webp"
    },
    {
      "id": "ulfrid",
      "name": "Ulfrid",
      "rarity": "ur",
      "faction": "warlock",
      "role": "tank",
      "image": "assets/images/heroes/ulfrid.webp"
    },
    {
      "id": "zoya",
      "name": "Zoya",
      "rarity": "ur",
      "faction": "warrior",
      "role": "carry",
      "image": "assets/images/heroes/zoya.webp"
    },
    {
      "id": "ash",
      "name": "Ash",
      "rarity": "ssr",
      "faction": "ranger",
      "role": "carry",
      "image": "assets/images/heroes/ash.webp"
    },
    {
      "id": "bella",
      "name": "Bella",
      "rarity": "ssr",
      "faction": "warrior",
      "role": "tank",
      "image": "assets/images/heroes/bella.webp"
    },
    {
      "id": "bestar",
      "name": "Bestar",
      "rarity": "ssr",
      "faction": "ranger",
      "role": "carry",
      "image": "assets/images/heroes/bestar.webp"
    },
    {
      "id": "celia",
      "name": "Celia",
      "rarity": "ssr",
      "faction": "warrior",
      "role": "support",
      "image": "assets/images/heroes/celia.webp"
    },
    {
      "id": "claire",
      "name": "Claire",
      "rarity": "ssr",
      "faction": "warrior",
      "role": "carry",
      "image": "assets/images/heroes/claire.webp"
    },
    {
      "id": "grenwald",
      "name": "Grenwald",
      "rarity": "ssr",
      "faction": "warlock",
      "role": "carry",
      "image": "assets/images/heroes/grenwald.webp"
    },
    {
      "id": "griffith",
      "name": "Griffith",
      "rarity": "ssr",
      "faction": "ranger",
      "role": "tank",
      "image": "assets/images/heroes/griffith.webp"
    },
    {
      "id": "hastar",
      "name": "Hastar",
      "rarity": "ssr",
      "faction": "warlock",
      "role": "tank",
      "image": "assets/images/heroes/hastar.webp"
    },
    {
      "id": "kesso",
      "name": "Kesso",
      "rarity": "ssr",
      "faction": "warrior",
      "role": "carry",
      "image": "assets/images/heroes/kesso.webp"
    },
    {
      "id": "lucius",
      "name": "Lucius",
      "rarity": "ssr",
      "faction": "warrior",
      "role": "tank",
      "image": "assets/images/heroes/lucius.webp"
    },
    {
      "id": "sivir",
      "name": "Sivir",
      "rarity": "ssr",
      "faction": "warrior",
      "role": "carry",
      "image": "assets/images/heroes/sivir.webp"
    },
    {
      "id": "stellar",
      "name": "Stellar",
      "rarity": "ssr",
      "faction": "warlock",
      "role": "support",
      "image": "assets/images/heroes/stellar.webp"
    },
    {
      "id": "durant",
      "name": "Durant",
      "rarity": "sr",
      "faction": "warrior",
      "role": "tank",
      "image": "assets/images/heroes/durant.webp"
    },
    {
      "id": "kafa",
      "name": "Kafa",
      "rarity": "sr",
      "faction": "warlock",
      "role": "carry",
      "image": "assets/images/heroes/kafa.webp"
    },
    {
      "id": "robin",
      "name": "Robin",
      "rarity": "sr",
      "faction": "ranger",
      "role": "carry",
      "image": "assets/images/heroes/robin.webp"
    },
    {
      "id": "william",
      "name": "William",
      "rarity": "sr",
      "faction": "warrior",
      "role": "carry",
      "image": "assets/images/heroes/william.webp"
    }
  ]
}
