{
  "schemaVersion": 1,
  "id": "vip-construction",
  "source": {
    "name": "Relevé en jeu du contributeur ; Last Asylum Wiki",
    "url": "https://wiki-last-asylum.com/en/wiki/vip",
    "type": "in-game",
    "status": "complete",
    "verifiedOn": "2026-09-16",
    "note": "Levels 4–20 and 50% cap confirmed by contributor on 2026-09-16. Levels 1–3 from community VIP table. Activation requirement from https://www.packsify.com/blogs/last-asylum-plague-vip-guide."
  },
  "semantics": {
    "valueMode": "at-level",
    "note": "Total construction speed percent at reached VIP level, not incremental. Applied only while VIP is active; inactive bonus is 0. Maximum VIP level 20."
  },
  "data": [
    {
      "level": 1,
      "constructionSpeedPercent": 0
    },
    {
      "level": 2,
      "constructionSpeedPercent": 0
    },
    {
      "level": 3,
      "constructionSpeedPercent": 10
    },
    {
      "level": 4,
      "constructionSpeedPercent": 10
    },
    {
      "level": 5,
      "constructionSpeedPercent": 15
    },
    {
      "level": 6,
      "constructionSpeedPercent": 20
    },
    {
      "level": 7,
      "constructionSpeedPercent": 25
    },
    {
      "level": 8,
      "constructionSpeedPercent": 30
    },
    {
      "level": 9,
      "constructionSpeedPercent": 35
    },
    {
      "level": 10,
      "constructionSpeedPercent": 40
    },
    {
      "level": 11,
      "constructionSpeedPercent": 45
    },
    {
      "level": 12,
      "constructionSpeedPercent": 50
    },
    {
      "level": 13,
      "constructionSpeedPercent": 50
    },
    {
      "level": 14,
      "constructionSpeedPercent": 50
    },
    {
      "level": 15,
      "constructionSpeedPercent": 50
    },
    {
      "level": 16,
      "constructionSpeedPercent": 50
    },
    {
      "level": 17,
      "constructionSpeedPercent": 50
    },
    {
      "level": 18,
      "constructionSpeedPercent": 50
    },
    {
      "level": 19,
      "constructionSpeedPercent": 50
    },
    {
      "level": 20,
      "constructionSpeedPercent": 50
    }
  ]
}
