{
  "$schema": "../game-dataset.schema.json",
  "schemaVersion": 1,
  "id": "raven",
  "source": {
    "name": "Last Asylum Database",
    "url": "https://lastasylumdatabase.com/raven",
    "type": "community",
    "status": "complete",
    "verifiedOn": "2026-08-23"
  },
  "semantics": {
    "valueMode": "upgrade-from-level",
    "note": "Rows are [fromLevel, toLevel, Raven Fruit cost, Raven Essence cost]; costs apply to each upgrade starting within the inclusive band."
  },
  "data": [
    [
      1,
      4,
      1000,
      0
    ],
    [
      5,
      5,
      2250,
      1
    ],
    [
      6,
      9,
      1500,
      0
    ],
    [
      10,
      10,
      3000,
      2
    ],
    [
      11,
      14,
      2000,
      0
    ],
    [
      15,
      15,
      3750,
      4
    ],
    [
      16,
      19,
      3600,
      0
    ],
    [
      20,
      20,
      4500,
      6
    ],
    [
      21,
      24,
      5600,
      0
    ],
    [
      25,
      25,
      5250,
      8
    ],
    [
      26,
      29,
      6000,
      0
    ],
    [
      30,
      30,
      6000,
      10
    ],
    [
      31,
      34,
      15000,
      0
    ],
    [
      35,
      35,
      7500,
      12
    ],
    [
      36,
      39,
      15000,
      0
    ],
    [
      40,
      40,
      7500,
      16
    ],
    [
      41,
      44,
      15000,
      0
    ],
    [
      45,
      45,
      7500,
      20
    ],
    [
      46,
      49,
      15000,
      0
    ],
    [
      50,
      50,
      7500,
      24
    ],
    [
      51,
      54,
      22500,
      0
    ],
    [
      55,
      55,
      9000,
      28
    ],
    [
      56,
      59,
      22500,
      0
    ],
    [
      60,
      60,
      9000,
      32
    ],
    [
      61,
      64,
      22500,
      0
    ],
    [
      65,
      65,
      9000,
      36
    ],
    [
      66,
      69,
      22500,
      0
    ],
    [
      70,
      70,
      9000,
      40
    ],
    [
      71,
      74,
      25000,
      0
    ],
    [
      75,
      75,
      10500,
      50
    ],
    [
      76,
      79,
      25000,
      0
    ],
    [
      80,
      80,
      10500,
      60
    ],
    [
      81,
      84,
      25000,
      0
    ],
    [
      85,
      85,
      10500,
      70
    ],
    [
      86,
      89,
      25000,
      0
    ],
    [
      90,
      90,
      10500,
      80
    ],
    [
      91,
      94,
      30000,
      0
    ],
    [
      95,
      95,
      12000,
      90
    ],
    [
      96,
      99,
      30000,
      0
    ],
    [
      100,
      100,
      12000,
      100
    ],
    [
      101,
      104,
      30000,
      0
    ],
    [
      105,
      105,
      15000,
      120
    ],
    [
      106,
      109,
      30000,
      0
    ],
    [
      110,
      110,
      15000,
      140
    ],
    [
      111,
      114,
      80000,
      0
    ],
    [
      115,
      115,
      36000,
      160
    ],
    [
      116,
      119,
      80000,
      0
    ],
    [
      120,
      120,
      36000,
      200
    ],
    [
      121,
      124,
      82000,
      0
    ],
    [
      125,
      125,
      42000,
      300
    ],
    [
      126,
      129,
      82000,
      0
    ],
    [
      130,
      130,
      42000,
      400
    ],
    [
      131,
      134,
      92000,
      0
    ],
    [
      135,
      135,
      48000,
      600
    ],
    [
      136,
      139,
      92000,
      0
    ],
    [
      140,
      140,
      48000,
      800
    ],
    [
      141,
      144,
      105000,
      0
    ],
    [
      145,
      145,
      60000,
      1000
    ],
    [
      146,
      149,
      105000,
      0
    ],
    [
      150,
      159,
      180000,
      100
    ],
    [
      160,
      169,
      216000,
      120
    ],
    [
      170,
      179,
      252000,
      140
    ],
    [
      180,
      189,
      288000,
      160
    ],
    [
      190,
      199,
      324000,
      180
    ],
    [
      200,
      209,
      360000,
      200
    ],
    [
      210,
      219,
      396000,
      220
    ],
    [
      220,
      229,
      432000,
      240
    ],
    [
      230,
      239,
      468000,
      260
    ],
    [
      240,
      249,
      504000,
      280
    ]
  ]
}
